{
  "$schema": "../../asset-metadata.schema.json",
  "name": "拖拽手柄",
  "tags": ["拖拽手柄", "拖拽", "手柄", "单色业务图标", "业务图标"],
  "use-cases": ["拖拽手柄相关入口或状态展示", "需要兼容历史业务视觉的 拖拽手柄 场景"],
  "i18n": {
    "en": {
      "name": "handle",
      "tags": ["handle", "mono", "business icon"],
      "use-cases": ["handle entry or status", "Legacy business visual for handle scenarios"]
    }
  }
}
