{
  "$schema": "../../asset-metadata.schema.json",
  "name": "文档填充",
  "tags": ["文档填充", "文档", "填充", "单色业务图标", "业务图标"],
  "use-cases": ["文档填充相关入口或状态展示", "需要兼容历史业务视觉的 文档填充 场景"],
  "i18n": {
    "en": {
      "name": "document filled",
      "tags": ["document filled", "document", "filled", "mono", "business icon"],
      "use-cases": [
        "document filled entry or status",
        "Legacy business visual for document filled scenarios"
      ]
    }
  }
}
