{
  "$schema": "../../asset-metadata.schema.json",
  "name": "联系人描边",
  "tags": ["联系人描边", "联系人", "描边", "单色业务图标", "业务图标"],
  "use-cases": ["联系人描边相关入口或状态展示", "需要兼容历史业务视觉的 联系人描边 场景"],
  "i18n": {
    "en": {
      "name": "contact outlined",
      "tags": ["contact outlined", "contact", "outlined", "mono", "business icon"],
      "use-cases": [
        "contact outlined entry or status",
        "Legacy business visual for contact outlined scenarios"
      ]
    }
  }
}
