{
  "$schema": "../../asset-metadata.schema.json",
  "name": "团队",
  "tags": ["团队", "单色业务图标", "业务图标"],
  "use-cases": ["团队相关入口或状态展示", "需要兼容历史业务视觉的 团队 场景"],
  "i18n": {
    "en": {
      "name": "team",
      "tags": ["team", "mono", "business icon"],
      "use-cases": ["team entry or status", "Legacy business visual for team scenarios"]
    }
  }
}
