{
  "$schema": "../../asset-metadata.schema.json",
  "name": "侧边栏",
  "tags": ["侧边栏", "侧边", "栏", "单色业务图标", "业务图标"],
  "use-cases": ["侧边栏相关入口或状态展示", "需要兼容历史业务视觉的 侧边栏 场景"],
  "i18n": {
    "en": {
      "name": "side bar",
      "tags": ["side bar", "side", "bar", "mono", "business icon"],
      "use-cases": ["side bar entry or status", "Legacy business visual for side bar scenarios"]
    }
  }
}
