{
  "$schema": "../../asset-metadata.schema.json",
  "name": "支付宝",
  "tags": ["支付宝", "单色业务图标", "业务图标"],
  "use-cases": ["支付宝相关入口或状态展示", "需要兼容历史业务视觉的 支付宝 场景"],
  "i18n": {
    "en": {
      "name": "alipay",
      "tags": ["alipay", "mono", "business icon"],
      "use-cases": ["alipay entry or status", "Legacy business visual for alipay scenarios"]
    }
  }
}
