{
  "$schema": "../../asset-metadata.schema.json",
  "name": "礼物",
  "tags": ["礼物", "单色业务图标", "业务图标"],
  "use-cases": ["礼物相关入口或状态展示", "需要兼容历史业务视觉的 礼物 场景"],
  "i18n": {
    "en": {
      "name": "gift",
      "tags": ["gift", "mono", "business icon"],
      "use-cases": ["gift entry or status", "Legacy business visual for gift scenarios"]
    }
  }
}
