{
  "$schema": "../../asset-metadata.schema.json",
  "name": "创建工单图标",
  "tags": ["创建工单图标", "创建", "工单", "图标", "单色业务图标", "业务图标"],
  "use-cases": ["创建工单图标相关入口或状态展示", "需要兼容历史业务视觉的 创建工单图标 场景"],
  "i18n": {
    "en": {
      "name": "create tickets icon",
      "tags": ["create tickets icon", "create", "tickets", "icon", "mono", "business icon"],
      "use-cases": [
        "create tickets icon entry or status",
        "Legacy business visual for create tickets icon scenarios"
      ]
    }
  }
}
