{
  "$schema": "../asset-metadata.schema.json",
  "name": "支付方式不可用",
  "tags": ["支付方式不可用", "支付禁用", "付款方式"],
  "use-cases": ["支付方式被禁用", "付款配置不可用"],
  "i18n": {
    "en": {
      "name": "Payment Method Disabled",
      "tags": ["payment method disabled", "payment", "method", "disabled"],
      "use-cases": ["Payment method is disabled", "Payment configuration is unavailable"]
    }
  }
}
