{
  "$schema": "../../asset-metadata.schema.json",
  "name": "权益优势模板",
  "tags": ["权益优势模板", "权益", "优势", "模板", "单色业务图标", "业务图标"],
  "use-cases": ["权益优势模板相关入口或状态展示", "需要兼容历史业务视觉的 权益优势模板 场景"],
  "i18n": {
    "en": {
      "name": "benefit template",
      "tags": ["benefit template", "benefit", "template", "mono", "business icon"],
      "use-cases": [
        "benefit template entry or status",
        "Legacy business visual for benefit template scenarios"
      ]
    }
  }
}
