{
  "$schema": "../../asset-metadata.schema.json",
  "name": "迁移描边",
  "tags": ["迁移描边", "迁移", "描边", "单色业务图标", "业务图标"],
  "use-cases": ["迁移描边相关入口或状态展示", "需要兼容历史业务视觉的 迁移描边 场景"],
  "i18n": {
    "en": {
      "name": "migrate outlined",
      "tags": ["migrate outlined", "migrate", "outlined", "mono", "business icon"],
      "use-cases": [
        "migrate outlined entry or status",
        "Legacy business visual for migrate outlined scenarios"
      ]
    }
  }
}
