{
  "$schema": "../../asset-metadata.schema.json",
  "name": "快捷回复检查",
  "tags": ["快捷回复检查", "快捷回复", "回复", "检查", "确认", "单色业务图标", "业务图标"],
  "use-cases": ["快捷回复检查确认", "需要兼容历史业务视觉的快捷回复检查场景"],
  "i18n": {
    "en": {
      "name": "canned response check",
      "tags": ["canned response check", "canned", "response", "check", "mono", "business icon"],
      "use-cases": [
        "canned response check entry or status",
        "Legacy business visual for canned response check scenarios"
      ]
    }
  }
}
