{
  "$schema": "../../asset-metadata.schema.json",
  "name": "奖杯",
  "tags": ["奖杯", "多色业务图标", "业务图标"],
  "use-cases": ["奖杯相关入口或状态展示", "需要兼容历史业务视觉的 奖杯 场景"],
  "i18n": {
    "en": {
      "name": "trophy",
      "tags": ["trophy", "multicolor", "business icon"],
      "use-cases": ["trophy entry or status", "Legacy business visual for trophy scenarios"]
    }
  }
}
