{
  "$schema": "../../asset-metadata.schema.json",
  "name": "二维码代码",
  "tags": ["二维码代码", "二维码", "代码", "单色业务图标", "业务图标"],
  "use-cases": ["二维码代码相关入口或状态展示", "需要兼容历史业务视觉的 二维码代码 场景"],
  "i18n": {
    "en": {
      "name": "qr code",
      "tags": ["qr code", "qr", "code", "mono", "business icon"],
      "use-cases": ["qr code entry or status", "Legacy business visual for qr code scenarios"]
    }
  }
}
