{
  "$schema": "../../asset-metadata.schema.json",
  "name": "更多价格",
  "tags": ["更多价格", "更多", "价格", "单色业务图标", "业务图标"],
  "use-cases": ["更多价格相关入口或状态展示", "需要兼容历史业务视觉的 更多价格 场景"],
  "i18n": {
    "en": {
      "name": "more price",
      "tags": ["more price", "more", "price", "mono", "business icon"],
      "use-cases": ["more price entry or status", "Legacy business visual for more price scenarios"]
    }
  }
}
